{
  "base": null,
  "metadata": {
    "format": "html",
    "name": "Classic",
    "description": "Responsive HTML theme with API navigation, topic menus, light and dark color modes, search, and configurable branding.",
    "version": "1.6.0",
    "author": "Kambiz Khojasteh",
    "license": "MIT",
    "homepage": "https://kampute.github.io/kampose/themes/classic-html-theme.html"
  },
  "parameters": {
    "projectName": {
      "type": "string",
      "description": "Project name shown in the header brand and browser page titles. On the home page it becomes the entire title; on other pages it prefixes the page title.",
      "defaultValue": null
    },
    "projectSlogan": {
      "type": "string",
      "description": "Short tagline shown beneath the project name in the header brand.",
      "defaultValue": null
    },
    "projectLogoUri": {
      "type": "uri",
      "description": "Absolute or output-root-relative URI of the single logo shown in the header. It is used only when both color-specific logo parameters are not set.",
      "defaultValue": null
    },
    "projectLogoDarkUri": {
      "type": "uri",
      "description": "Absolute or output-root-relative URI of the logo displayed in dark color mode. It takes effect only when projectLogoLightUri is also set; together they replace projectLogoUri.",
      "defaultValue": null
    },
    "projectLogoLightUri": {
      "type": "uri",
      "description": "Absolute or output-root-relative URI of the logo displayed in light color mode. It takes effect only when projectLogoDarkUri is also set; together they replace projectLogoUri.",
      "defaultValue": null
    },
    "faviconUri": {
      "type": "uri",
      "description": "Absolute or output-root-relative URI added to every page as its browser favicon.",
      "defaultValue": null
    },
    "styleUri": {
      "type": "uri",
      "description": "Absolute or output-root-relative URI of an additional stylesheet loaded after the theme's bundled styles, allowing it to extend or override them.",
      "defaultValue": null
    },
    "scriptUri": {
      "type": "uri",
      "description": "Absolute or output-root-relative URI of an additional script loaded after the theme bundles and Prism syntax highlighting script.",
      "defaultValue": null
    },
    "pageHeader": {
      "type": "markdown",
      "description": "Markdown rendered above the main content on every page. Accepts one string or an array of strings joined with newlines, and may contain Handlebars expressions that use the page's template data.",
      "defaultValue": null
    },
    "pageFooter": {
      "type": "markdown",
      "description": "Markdown rendered in the left side of every page footer. Accepts one string or an array of strings joined with newlines, and may contain Handlebars expressions that use the page's template data.",
      "defaultValue": null
    },
    "pageFooterRight": {
      "type": "markdown",
      "description": "Markdown rendered in the right side of every page footer. Accepts one string or an array of strings joined with newlines, and may contain Handlebars expressions that use the page's template data.",
      "defaultValue": null
    },
    "menuItems": {
      "type": "array",
      "description": "Top menu entries. An object uses title for its label, optional url for its link, and optional items for a nested submenu. A string names a topic slug to insert, \"*\" inserts all documentation topics, and \"-\" inserts a divider; these forms may be used at any nesting level. An empty array hides the menu bar.",
      "defaultValue": []
    },
    "excludeBreadcrumb": {
      "type": "boolean",
      "description": "When true, removes the breadcrumb trail below the page header.",
      "defaultValue": false
    },
    "excludeLeftSidebar": {
      "type": "boolean",
      "description": "When true, removes the searchable site navigation from the left sidebar and its mobile navigation button.",
      "defaultValue": false
    },
    "excludeRightSidebar": {
      "type": "boolean",
      "description": "When true, removes the right sidebar containing navigation for sections on the current page.",
      "defaultValue": false
    },
    "groupTypesByNamespace": {
      "type": "boolean",
      "description": "When true, retains namespace groups in the left API navigation. When false, type entries are flattened and sorted by title when namespace pages are available.",
      "defaultValue": false
    },
    "showTypeMembersSummary": {
      "type": "boolean",
      "description": "When true, adds a member summary to type pages when the selected convention generates separate pages for individual members. It has no effect when members are expanded directly on their type page.",
      "defaultValue": false
    },
    "seeAlsoSubtopics": {
      "type": "boolean",
      "description": "When true, appends a See Also list of a topic's immediate child topics to each topic page.",
      "defaultValue": false
    },
    "externalLinksSamePage": {
      "type": "boolean",
      "description": "When true, links to other origins open in the current tab. When false, they open in a new tab that has no access to the linking page and receives no referrer.",
      "defaultValue": false
    },
    "popupAssetNames": {
      "type": "array",
      "description": "Case-insensitive filenames that open in an in-page preview modal when linked from generated content. Prefix a value with \"*\" to match a filename suffix such as an extension; other values match the complete filename. Only same-origin links are eligible.",
      "defaultValue": ["LICENSE", "DISCLAIMER"]
    }
  },
  "templates": [
    "templates/**/*.hbs"
  ],
  "scripts": {
    "source": [
      "scripts/**/*.js"
    ],
    "targetPath": "script.js"
  },
  "styles": {
    "source": [
      "styles/**/*.css"
    ],
    "targetPath": "style.css"
  },
  "assets": [
    "prism.min.js",
    ".nojekyll"
  ]
}
