{
  "base": null,
  "metadata": {
    "format": "md",
    "name": "Classic",
    "description": "Markdown theme for Azure DevOps Wiki and GitLab Wiki output, with configurable page framing and optional child-topic links.",
    "version": "1.2.0",
    "author": "Kambiz Khojasteh",
    "license": "MIT",
    "homepage": "https://kampute.github.io/dot-doc/themes/classic-md.html"
  },
  "parameters": {
    "pageHeader": {
      "type": "markdown",
      "description": "Markdown inserted before the generated content on every page. Accepts one string or an array of strings joined with newlines, and may contain Handlebars expressions that use the page's template data.",
      "defaultValue": null
    },
    "pageFooter": {
      "type": "markdown",
      "description": "Markdown inserted after a horizontal rule at the end of every page. Accepts one string or an array of strings joined with newlines, and may contain Handlebars expressions that use the page's template data.",
      "defaultValue": null
    },
    "seeAlsoSubtopics": {
      "type": "boolean",
      "description": "When true, appends a See Also list of a topic's immediate child topics to each topic page.",
      "defaultValue": false
    }
  },
  "templates": [ "templates/**/*.hbs" ],
  "assets": []
}
